{
  "$schema": "https://json-schema.org/draft/2020-12/schema",
  "type": "object",
  "properties": {
    "image": {
      "type": "string"
    },
    "title": {
      "type": "string"
    },
    "description": {
      "type": "string"
    },
    "link": {
      "type": "string"
    },
    "$schema": {
      "type": "string"
    }
  },
  "required": [
    "image",
    "title",
    "description",
    "link"
  ]
}