{
    "image": "/images/lume.png",
    "title": "Lumé Studio",
    "description": "Sitio web estático diseñado para un negocio de uñas, enfocado en presentar de forma clara y atractiva los servicios, precios y estilos disponibles, facilitando la captación de clientes y el contacto directo sin necesidad de funcionalidades dinámicas complejas.",
    "link": "https://lume-studio.mikeonlinemx.workers.dev/"
}