{
    "image": "/images/smart-key.png",
    "title": "Smart Key",
    "description": "Smart Key es una Plataforma tecnológica para mejorar la comunicación escrita entre personas y sistemas digitales, mejorando la interacción con inteligencia artificial mediante prompts más precisos.",
    "link": "https://smart-key.mx/"
}